{
  "schemaVersion": "locator-envelope.v1",
  "kind": "bookmark",
  "sourceId": "contract-markdown",
  "nodeId": "md-0001",
  "scopeKey": "document",
  "activeWordIndex": 0,
  "locator": {
    "type": "markdown",
    "markdown": {
      "path": "contract.md",
      "lineStart": 3,
      "lineEnd": 3,
      "columnStart": 1,
      "columnEnd": 22,
      "astPath": "/children/1"
    }
  },
  "readium": {
    "title": "contract.md",
    "text": {
      "highlight": "Dr Nguyen shipped v1."
    },
    "href": "contract.md",
    "type": "text/markdown",
    "locations": {
      "fragments": ["line=3"],
      "position": 3
    }
  },
  "textQuote": "Dr Nguyen shipped v1."
}
