{
  "schemaVersion": "locator-envelope.v1",
  "kind": "bookmark",
  "sourceId": "contract-ocr",
  "nodeId": "ocr-0001",
  "scopeKey": "document",
  "activeWordIndex": 0,
  "locator": {
    "type": "ocr",
    "ocr": {
      "pageIndex": 0,
      "polygon": [
        {
          "x": 10,
          "y": 20
        },
        {
          "x": 260,
          "y": 20
        },
        {
          "x": 260,
          "y": 58
        },
        {
          "x": 10,
          "y": 58
        }
      ],
      "ocrEngine": "tesseract",
      "ocrConfidence": 0.84
    }
  },
  "readium": {
    "title": "Page 1",
    "text": {
      "highlight": "OCR page text."
    },
    "href": "contract-ocr",
    "type": "image/*",
    "locations": {
      "fragments": ["page=1"],
      "position": 1
    }
  },
  "textQuote": "OCR page text."
}
