{
  "schemaVersion": "locator-envelope.v1",
  "kind": "bookmark",
  "sourceId": "contract-docx",
  "nodeId": "docx-0001",
  "scopeKey": "document",
  "activeWordIndex": 0,
  "locator": {
    "type": "docx",
    "docx": {
      "paragraphIndex": 0,
      "runIndex": 0,
      "bookmarkId": "intro"
    }
  },
  "readium": {
    "title": "contract.docx",
    "text": {
      "highlight": "DOCX paragraph."
    },
    "href": "contract-docx",
    "type": "application/vnd.openxmlformats-officedocument.wordprocessingml.document",
    "locations": {
      "fragments": ["paragraph=1"],
      "position": 1
    }
  },
  "textQuote": "DOCX paragraph."
}
